{
  "schema_version": "early-bird-authority.membership.v3",
  "account_id": "account_synthetic_founder_0001",
  "membership_revision": 3,
  "state": "EXPIRED",
  "source": "PAYPAL",
  "access_allowed": false,
  "effective_at": "2026-08-06T12:00:00Z",
  "paid_through": "2026-09-06T12:00:00Z",
  "grace_until": null,
  "offer": {"code": "EARLY_BIRDS_FOUNDERS_V1", "revision": 1},
  "provider": "paypal",
  "current_price": {"currency": "USD", "amount_minor": 500},
  "free_entitlement_consumed": true,
  "reason_code": "PERIOD_ENDED",
  "founder_continuity": {
    "episode_id": "eb300000-0000-4000-8000-000000000001",
    "revision": 4,
    "state": "ENDED",
    "offer": {"code": "EARLY_BIRDS_FOUNDERS_V1", "revision": 1},
    "canonical_price": {"currency": "USD", "amount_minor": 500},
    "billing_period": "MONTHLY",
    "activated_at": "2026-08-06T12:00:00Z",
    "service_through": "2026-09-06T12:00:00Z",
    "ended_at": "2026-09-06T12:00:01Z",
    "terminal_reason": "PERIOD_ENDED"
  }
}
